{"action_catalog":{"action_profile":"semantic-grid-actions-v1","actions":[{"action_id":"move_to","argument_schema":{"additionalProperties":false,"properties":{"navigation":{"const":"direct_only"},"target":{"oneOf":[{"additionalProperties":false,"properties":{"position":{"additionalProperties":false,"properties":{"x":{"type":"integer"},"y":{"type":"integer"}},"required":["x","y"],"type":"object"}},"required":["position"],"type":"object"},{"additionalProperties":false,"properties":{"generation":{"minimum":1,"type":"integer"},"object_id":{"type":"string"}},"required":["object_id","generation"],"type":"object"}]}},"required":["target","navigation"],"type":"object"},"authority":{"game_may":["apply_declared_motion","resolve_collision","detect_blockage"],"game_must_not":["choose_detour","change_target"],"navigation":"direct_only","target_selection":"declared_target_only"},"cancellation_boundary":"tick_boundary","duration":{"kind":"persistent","maximum_ticks":200},"preconditions":["target_visible_or_coordinate_known"],"receipt_codes":["target_reached","movement_blocked","lease_expired"],"refusal_conditions":["target_identity_stale","coordinate_out_of_bounds"]},{"action_id":"equip","argument_schema":{"additionalProperties":false,"properties":{"item":{"enum":["axe","pickaxe"]}},"required":["item"],"type":"object"},"authority":{"game_may":["update_equipped_item"],"game_must_not":["select_item"],"navigation":"none","target_selection":"agent_only"},"cancellation_boundary":"completion","duration":{"kind":"instant","maximum_ticks":1},"preconditions":["item_in_inventory"],"receipt_codes":["item_equipped","item_unavailable"],"refusal_conditions":["item_unavailable"]},{"action_id":"use_tool","argument_schema":{"additionalProperties":false,"properties":{"target":{"additionalProperties":false,"properties":{"generation":{"minimum":1,"type":"integer"},"object_id":{"type":"string"}},"required":["object_id","generation"],"type":"object"},"tool":{"enum":["axe","pickaxe"]}},"required":["tool","target"],"type":"object"},"authority":{"game_may":["apply_tool_effect","resolve_target_lifecycle"],"game_must_not":["change_target","select_tool"],"navigation":"none","target_selection":"declared_target_only"},"cancellation_boundary":"completion","duration":{"kind":"instant","maximum_ticks":1},"preconditions":["tool_equipped","target_in_range"],"receipt_codes":["target_destroyed","target_missing","target_out_of_range","tool_not_equipped","tool_has_no_effect"],"refusal_conditions":["target_identity_stale","target_out_of_range","tool_not_equipped"]},{"action_id":"wait","argument_schema":{"additionalProperties":false,"properties":{},"required":[],"type":"object"},"authority":{"game_may":["advance_authorized_ticks"],"game_must_not":["continue_other_plan"],"navigation":"none","target_selection":"agent_only"},"cancellation_boundary":"tick_boundary","duration":{"kind":"persistent","maximum_ticks":50},"preconditions":[],"receipt_codes":["wait_complete"],"refusal_conditions":[]},{"action_id":"cancel","argument_schema":{"additionalProperties":false,"properties":{},"required":[],"type":"object"},"authority":{"game_may":["cancel_current_action"],"game_must_not":["select_replacement_action"],"navigation":"none","target_selection":"agent_only"},"cancellation_boundary":"immediate","duration":{"kind":"instant","maximum_ticks":1},"preconditions":[],"receipt_codes":["action_cancelled"],"refusal_conditions":[]}],"catalog_id":"primitive-sandbox-actions-v1","protocol":"worldeval-agent/0.1.0","schema_version":"action-catalog.v1"},"active_objective":{"coordinate_frame":"world_grid","failure_predicates":[{"kind":"tick_budget_exhausted","parameters":{"maximum_tick":200},"subject":null}],"instruction":"Destroy tree-7 at (23,12) before the tick limit.","objective_id":"tree-chop-nominal-v0","permitted_fallback":"fail","priorities":["destroy_tree","avoid_invalid_actions"],"protocol":"worldeval-agent/0.1.0","safety_constraints":[],"schema_version":"objective.v1","success_predicates":[{"kind":"object_destroyed","parameters":{"generation":1},"subject":"tree-7"}],"targets":[{"object_id":"tree-7","object_type":"tree","position":{"x":23,"y":12},"role":"resource"}],"tick_budget":200},"authority":{"engine":"godot","numeric_model":"integer-grid","simulation_hz":10},"briefing":{"agent_role":"You control worker-1 and make every navigation, equipment, and interaction decision.","premise":"A deterministic resource-gathering sandbox for reusable object and action primitives.","rules":["Coordinates use the world_grid frame with x east and y north.","move_to follows only the direct line to the exact target or waypoint you choose.","The authority resolves physics and collisions but never chooses a detour or replacement target.","Every decision boundary requires an explicit continue, replace, abort, or wait response.","Missing, invalid, timed-out, or stale responses are neutral no-ops."],"success_model":"Satisfy the active objective and its safety priorities before the 200-tick limit."},"capabilities":[{"available":true,"capability_id":"semantic_actions","reason":null},{"available":true,"capability_id":"exact_coordinates","reason":null}],"contracts":{"action_catalog":"schemas/action-catalog.v1.schema.json","action_plan":"schemas/action-plan.v1.schema.json","action_receipt":"schemas/action-receipt.v1.schema.json","decision_profile":"schemas/decision-profile.v1.schema.json","decision_response":"schemas/decision-response.v1.schema.json","environment_init":"schemas/environment-init.v1.schema.json","object_catalog":"schemas/object-catalog.v1.schema.json","objective":"schemas/objective.v1.schema.json","observation":"schemas/observation.v1.schema.json","replay_bundle":"schemas/replay-bundle.v1.schema.json","skill_manifest":"schemas/skill-manifest.v1.schema.json"},"controlled_assets":[{"affordances":["movable","can_equip","can_use_tool"],"capabilities":["locomotion","equip","use_tool"],"generation":1,"object_id":"worker-1","position":{"x":2,"y":12},"state":{"equipped":null,"health":100,"inventory":["axe","pickaxe"]},"type_id":"worker"}],"coordinate_frames":[{"dimensions":2,"frame_id":"world_grid","height":25,"origin":"bottom_left","units":"cells","width":30,"x_axis":"east","y_axis":"north"}],"decision_profile":{"default_ticks":3,"explicit_response_required":true,"interrupt_events":["movement_blocked","target_disappeared","hostile_near_target","inventory_changed","health_threshold_crossed","objective_revised","plan_precondition_false"],"kind":"dynamic-step-locked","maximum_ticks":5,"minimum_ticks":1,"missing_response_behavior":"neutral_noop","observation_policy":"every_boundary","profile_id":"dynamic-step-locked-v1","protocol":"worldeval-agent/0.1.0","schema_version":"decision-profile.v1","simulation_pauses_during_inference":true},"environment_id":"worldarena-primitive-sandbox-v0","example_traces":["examples/tree-chop-plan.json","examples/barrier-detour-plan.json"],"game_id":"worldarena-primitive-sandbox-v0","initialization_hash":"sha256:5930269147bee3f47393676128d3405837af8002108e664048aa159378497678","object_catalog":{"catalog_id":"primitive-sandbox-objects-v1","object_types":[{"affordances":["movable","can_equip","can_use_tool"],"lifecycle_events":["spawned","updated","despawned"],"stable_identity":true,"traits":["controllable","mobile","inventory_holder"],"type_id":"worker","visible_state_fields":["position","inventory","equipped","health"]},{"affordances":["approachable","safe_return_target"],"lifecycle_events":["spawned","updated","despawned"],"stable_identity":true,"traits":["structure","safe_zone"],"type_id":"base","visible_state_fields":["position"]},{"affordances":["approachable","choppable"],"lifecycle_events":["spawned","updated","despawned"],"stable_identity":true,"traits":["resource","destructible"],"type_id":"tree","visible_state_fields":["position","health"]},{"affordances":["blocks_movement"],"lifecycle_events":["spawned","updated","despawned"],"stable_identity":true,"traits":["obstacle"],"type_id":"barrier","visible_state_fields":["position","blocks_movement"]},{"affordances":["visible_hostile"],"lifecycle_events":["spawned","updated","despawned"],"stable_identity":true,"traits":["hostile","mobile"],"type_id":"enemy","visible_state_fields":["position","health","hostile"]}],"protocol":"worldeval-agent/0.1.0","schema_version":"object-catalog.v1"},"profiles":{"action":"semantic-grid-actions-v1","decision":"dynamic-step-locked-v1","observation":"semantic-grid-visible-v1"},"protocol":"worldeval-agent/0.1.0","schema_version":"environment-init.v1","session_id":"demo-nominal-v0"}