{"action_catalog":{"action_profile":"semantic-grid-actions-v1","actions":[{"action_id":"move_to","argument_schema":{"additionalProperties":false,"properties":{"navigation":{"const":"direct_only"},"target":{"oneOf":[{"additionalProperties":false,"properties":{"position":{"additionalProperties":false,"properties":{"x":{"type":"integer"},"y":{"type":"integer"}},"required":["x","y"],"type":"object"}},"required":["position"],"type":"object"},{"additionalProperties":false,"properties":{"generation":{"minimum":1,"type":"integer"},"object_id":{"type":"string"}},"required":["object_id","generation"],"type":"object"}]}},"required":["target","navigation"],"type":"object"},"authority":{"game_may":["apply_declared_motion","resolve_collision","detect_blockage"],"game_must_not":["choose_detour","change_target"],"navigation":"direct_only","target_selection":"declared_target_only"},"cancellation_boundary":"tick_boundary","duration":{"kind":"persistent","maximum_ticks":80},"preconditions":["target_visible_or_coordinate_known"],"receipt_codes":["target_reached","movement_blocked","lease_expired"],"refusal_conditions":["target_identity_stale","coordinate_out_of_bounds"]},{"action_id":"wait","argument_schema":{"additionalProperties":false,"properties":{},"required":[],"type":"object"},"authority":{"game_may":["advance_authorized_ticks"],"game_must_not":["continue_other_plan"],"navigation":"none","target_selection":"agent_only"},"cancellation_boundary":"tick_boundary","duration":{"kind":"persistent","maximum_ticks":50},"preconditions":[],"receipt_codes":["wait_complete"],"refusal_conditions":[]},{"action_id":"cancel","argument_schema":{"additionalProperties":false,"properties":{},"required":[],"type":"object"},"authority":{"game_may":["cancel_current_action"],"game_must_not":["select_replacement_action"],"navigation":"none","target_selection":"agent_only"},"cancellation_boundary":"immediate","duration":{"kind":"instant","maximum_ticks":1},"preconditions":[],"receipt_codes":["action_cancelled"],"refusal_conditions":[]}],"catalog_id":"waypoint-maze-actions-v1","protocol":"worldeval-agent/0.1.0","schema_version":"action-catalog.v1"},"active_objective":{"coordinate_frame":"maze_grid","failure_predicates":[{"kind":"tick_budget_exhausted","parameters":{"maximum_tick":80},"subject":null}],"instruction":"Visit beacon-1, beacon-2, beacon-3, and beacon-4 in order, then reach exit-1 before tick 80.","objective_id":"beacon-route-v0","permitted_fallback":"fail","priorities":["visit_waypoints_in_order","avoid_invalid_actions","minimize_decision_calls"],"protocol":"worldeval-agent/0.1.0","safety_constraints":[],"schema_version":"objective.v1","success_predicates":[{"kind":"route_complete","parameters":{"ordered_targets":["beacon-1","beacon-2","beacon-3","beacon-4","exit-1"]},"subject":"navigator-1"}],"targets":[{"object_id":"beacon-1","object_type":"waypoint","position":{"x":1,"y":6},"role":"waypoint"},{"object_id":"beacon-2","object_type":"waypoint","position":{"x":5,"y":6},"role":"waypoint"},{"object_id":"beacon-3","object_type":"waypoint","position":{"x":5,"y":2},"role":"waypoint"},{"object_id":"beacon-4","object_type":"waypoint","position":{"x":9,"y":2},"role":"waypoint"},{"object_id":"exit-1","object_type":"exit","position":{"x":10,"y":7},"role":"exit"}],"tick_budget":80},"authority":{"engine":"godot","numeric_model":"integer-grid","simulation_hz":10},"briefing":{"agent_role":"You control navigator-1 and must explicitly select every waypoint and movement target.","premise":"A deterministic fixed-wall maze tests reusable semantic navigation and sparse decision timing.","rules":["Coordinates use maze_grid with x east and y north.","All route markers and fixed walls are visible from initialization.","move_to follows only the direct line to the exact target you declare.","The authority resolves movement and collisions but never chooses a waypoint, path, or detour.","A waypoint event or other material event ends the current static lease early.","Every reopened boundary requires an explicit response; silence and invalid output are neutral no-ops."],"success_model":"Visit the four numbered beacons in order, then reach exit-1 before the 80-tick limit."},"capabilities":[{"available":true,"capability_id":"semantic_actions","reason":null},{"available":true,"capability_id":"exact_coordinates","reason":null},{"available":true,"capability_id":"portable_skill_templates","reason":null}],"contracts":{"action_catalog":"schemas/action-catalog.v1.schema.json","action_plan":"schemas/action-plan.v1.schema.json","action_receipt":"schemas/action-receipt.v1.schema.json","decision_profile":"schemas/decision-profile.v1.schema.json","decision_response":"schemas/decision-response.v1.schema.json","environment_init":"schemas/environment-init.v1.schema.json","object_catalog":"schemas/object-catalog.v1.schema.json","objective":"schemas/objective.v1.schema.json","observation":"schemas/observation.v1.schema.json","replay_bundle":"schemas/replay-bundle.v1.schema.json","skill_manifest":"schemas/skill-manifest.v1.schema.json"},"controlled_assets":[{"affordances":["movable"],"capabilities":["locomotion"],"generation":1,"object_id":"navigator-1","position":{"x":1,"y":1},"state":{"visited_waypoints":[]},"type_id":"navigator"}],"coordinate_frames":[{"dimensions":2,"frame_id":"maze_grid","height":9,"origin":"bottom_left","units":"cells","width":12,"x_axis":"east","y_axis":"north"}],"decision_profile":{"default_ticks":50,"explicit_response_required":true,"interrupt_events":["waypoint_reached","movement_blocked","target_disappeared","objective_revised","plan_precondition_false"],"kind":"static-event-gated","maximum_ticks":50,"minimum_ticks":1,"missing_response_behavior":"neutral_noop","observation_policy":"event_or_lease_expiry","profile_id":"static-event-gated-v1","protocol":"worldeval-agent/0.1.0","schema_version":"decision-profile.v1","simulation_pauses_during_inference":true},"environment_id":"worldarena-waypoint-maze-v0","example_traces":["examples/beacon-route-plan.json"],"game_id":"worldarena-waypoint-maze-v0","initialization_hash":"sha256:7d679add1b261efb218e030ef429e9892306a22c2934c9a12cd3d6b6a9e5b303","object_catalog":{"catalog_id":"waypoint-maze-objects-v1","object_types":[{"affordances":["movable"],"lifecycle_events":["spawned","updated","despawned"],"stable_identity":true,"traits":["controllable","mobile"],"type_id":"navigator","visible_state_fields":["position","visited_waypoints"]},{"affordances":["approachable","ordered_route_marker"],"lifecycle_events":["spawned","updated","despawned"],"stable_identity":true,"traits":["route_marker"],"type_id":"waypoint","visible_state_fields":["position","order","visited"]},{"affordances":["approachable","ordered_route_marker"],"lifecycle_events":["spawned","updated","despawned"],"stable_identity":true,"traits":["terminal_target"],"type_id":"exit","visible_state_fields":["position","order","open"]},{"affordances":["blocks_movement"],"lifecycle_events":["spawned","updated","despawned"],"stable_identity":true,"traits":["fixed_obstacle"],"type_id":"wall","visible_state_fields":["position","blocks_movement"]}],"protocol":"worldeval-agent/0.1.0","schema_version":"object-catalog.v1"},"profiles":{"action":"semantic-grid-actions-v1","decision":"static-event-gated-v1","observation":"semantic-grid-visible-v1"},"protocol":"worldeval-agent/0.1.0","schema_version":"environment-init.v1","session_id":"demo-waypoint-maze-v0"}